Institute ID,Name,TLR,RPC,GO,OI,Perception,City,State,Score,Rank
IR-M-S-8890,Indian Institute of Management Ahmedabad,91.88,63.89,98.71,71.72,96.81,Ahmedabad,Gujarat,83.32,1
IR-M-S-8903,Indian Institute of Management Bangalore,90.08,56.71,98.41,74.54,100.00,Bengaluru,Karnataka,81.16,2
IR-M-S-8909,Indian Institute of Management Kozhikode,86.99,58.96,94.37,77.10,75.30,Kozhikode,Kerala,77.90,3
IR-M-I-1074,Indian Institute of Technology Delhi,72.21,78.39,89.51,67.37,64.25,New Delhi,Delhi,76.25,4
IR-M-S-8972,Indian Institute of Management Calcutta,84.12,48.09,99.09,70.46,85.29,Kolkata,West Bengal,75.07,5
IR-M-S-8931,Indian Institute of Management Mumbai,80.81,59.14,99.41,75.86,52.82,Mumbai,Maharashtra,74.73,6
IR-M-S-8959,Indian Institute of Management Lucknow,84.25,49.09,96.59,71.17,79.81,Lucknow,Uttar Pradesh,74.43,7
IR-M-S-8918,Indian Institute of Management Indore,84.08,55.28,93.49,72.38,57.93,Indore,Madhya Pradesh,73.53,8
IR-M-S-132,XLRI - Xavier School of Management,85.49,39.79,97.92,64.57,45.02,Jamshedpur,Jharkhand,68.13,9
IR-M-U-0306,Indian Institute of Technology Bombay,78.30,61.64,79.25,58.83,34.50,Mumbai,Maharashtra,67.16,10
IR-M-I-1170,Management Development Institute,75.87,50.74,95.24,71.05,27.07,Gurugram,Haryana,66.85,11
IR-M-S-8895,Indian Institute of Management Rohtak,79.69,45.01,88.90,75.98,37.00,Rohtak,Haryana,66.49,12
IR-M-C-19343,Symbiosis Institute of Business Management,75.51,42.85,94.27,66.50,41.21,Pune,Maharashtra,65.13,13
IR-M-S-8868,Indian Institute of Management Raipur,78.31,41.28,90.68,80.55,23.25,Raipur,Chhattisgarh,64.40,14
IR-M-U-0102,Indian Institute of Foreign Trade,80.36,32.80,87.48,66.49,42.58,New Delhi,Delhi,62.36,15
IR-M-U-0456,Indian Institute of Technology Madras,70.39,47.93,75.10,60.43,51.74,Chennai,Tamil Nadu,61.73,16
IR-M-S-8904,Indian Institute of Management Ranchi,70.89,39.65,89.45,71.42,30.82,Ranchi,Jharkhand,61.27,17
IR-M-U-0560,Indian Institute of Technology Roorkee,68.08,59.00,71.09,62.16,26.50,Roorkee,Uttarakhand,61.21,18
IR-M-U-0573,Indian Institute of Technology Kharagpur,50.10,63.68,87.88,55.17,37.88,Kharagpur,West Bengal,61.03,19
IR-M-I-1044,S. P. Jain Institute of Management and Research,78.86,26.60,98.65,68.90,27.07,Mumbai,Maharashtra,60.97,20
IR-M-N-10,SVKM`s Narsee Monjee Institute of Management Studies,78.42,29.96,92.39,76.71,22.95,Mumbai,Maharashtra,60.96,21
IR-M-S-8942,Indian Institute of Management Udaipur,79.21,33.95,88.69,72.05,20.39,Udaipur,Rajasthan,60.93,22
IR-M-S-8967,Indian Institute of Management Kashipur,67.95,40.39,89.06,74.47,30.56,Kashipur,Uttarakhand,60.82,23
IR-M-S-8937,Indian Institute of Management Shillong,74.68,28.33,94.96,74.09,31.83,Shillong,Meghalaya,60.49,24
IR-M-U-0108,Jamia Millia Islamia,65.45,48.39,81.46,83.65,15.14,New Delhi,Delhi,60.32,25
IR-M-U-1007,Indian Institute of Management Visakhapatnam,80.81,22.51,86.10,70.53,39.37,Visakhapatnam,Andhra Pradesh,59.20,26
IR-M-S-8948,Indian Institute of Management Tiruchirappalli,60.97,29.09,87.47,69.74,61.89,Tiruchirappalli,Tamil Nadu,57.67,27
IR-M-U-0436,Amrita Vishwa Vidyapeetham,64.11,41.40,73.51,75.50,34.97,Coimbatore,Tamil Nadu,57.40,28
IR-M-U-0497,Amity University,70.39,54.11,58.85,67.49,13.62,Gautam Budh Nagar,Uttar Pradesh,57.23,29
IR-M-I-1075,Indian Institute of Technology Kanpur,66.90,44.97,77.90,48.81,32.08,Kanpur,Uttar Pradesh,57.23,29
IR-M-S-15962,Indian Institute of Management Nagpur,71.57,27.17,86.55,70.33,29.78,Nagpur,Maharashtra,56.94,31
IR-M-S-14875,MICA,70.52,38.08,84.36,68.13,3.60,Ahmedabad,Gujarat,56.62,32
IR-M-U-1006,Indian Institute of Management Bodh Gaya,75.08,25.80,84.73,69.59,21.05,Gaya,Bihar,56.27,33
IR-M-N-16,Great Lakes Institute of Management,78.30,22.05,81.85,73.36,23.25,Chennai,Tamil Nadu,56.15,34
IR-M-S-394,Institute of Management Technology,76.46,32.51,80.64,63.76,8.25,Ghaziabad,Uttar Pradesh,56.03,35
IR-M-U-0747,Chandigarh University,75.30,30.03,70.22,80.58,20.06,Mohali,Punjab,55.71,36
IR-M-S-87,Goa Institute of Management,75.11,25.94,84.41,71.65,13.23,Sanquelim,Goa,55.67,37
IR-M-U-0379,Lovely Professional University,73.49,38.97,62.87,75.19,16.61,Phagwara,Punjab,55.49,38
IR-M-U-0012,"ICFAI Foundation for Higher Education, Hyderabad",75.59,26.77,75.96,76.06,18.02,Hyderabad,Telangana,55.31,39
IR-M-I-1064,International Management Institute,72.25,26.29,87.23,69.58,9.12,New Delhi,Delhi,54.89,40
IR-M-U-0564,UPES,73.29,32.94,67.39,65.68,28.99,Dehradun,Uttarakhand,54.82,41
IR-M-U-1004,Indian Institute of Management Jammu (IIMJ),73.73,16.68,86.87,73.31,28.18,Jammu,Jammu and Kashmir,54.64,42
IR-M-U-0715,XIM University,73.86,21.36,91.24,55.04,21.69,Bhubaneswar,Odisha,54.49,43
IR-M-I-1480,Thapar Institute of Engineering and Technology (Deemed-to-be-university),66.13,42.28,63.22,72.33,8.69,Patiala,Punjab,53.26,44
IR-M-S-3283,Jaipuria Institute of Management,67.35,28.22,76.47,67.15,25.35,Noida,Uttar Pradesh,53.23,45
IR-M-U-0205,Indian Institute of Technology (Indian School of Mines) Dhanbad,70.67,41.31,55.53,63.79,16.96,Dhanbad,Jharkhand,52.78,46
IR-M-S-16881,Indian Institute of Management Amritsar,67.83,18.63,87.86,67.99,22.63,Amritsar,Punjab,52.57,47
IR-M-U-0500,Banaras Hindu University,62.18,29.50,81.82,56.41,27.63,Varanasi,Uttar Pradesh,52.26,48
IR-M-S-92,Institute of Rural Management Anand (IRMA),65.29,22.36,87.73,64.13,12.84,Anand,Gujarat,51.54,49
IR-M-S-6,Indian Institute of Management Sambalpur,64.06,18.02,81.32,75.56,30.31,Sambalpur,Odisha,51.47,50
IR-M-U-0467,National Institute of Technology Tiruchirappalli,54.19,39.84,71.84,61.66,26.50,Tiruchirappalli,Tamil Nadu,51.40,51
IR-M-S-17295,Great Lakes Institute of Management,76.53,18.83,72.51,79.25,3.10,Gurgaon,Haryana,51.35,52
IR-M-I-1066,Fore School of Management,70.42,17.93,85.12,62.40,13.23,New Delhi,Delhi,51.08,53
IR-M-U-0373,Chitkara University,71.22,33.81,57.30,75.06,5.52,Rajpura,Punjab,51.02,54
IR-M-U-0146,Nirma University,64.09,27.69,80.98,63.98,8.69,Ahmedabad,Gujarat,51.01,55
IR-M-I-1408,"International Management Institute, Kolkata",63.64,30.94,79.30,66.28,1.06,Kolkata,West Bengal,50.97,56
IR-M-S-15911,Indian Institute of Management Sirmaur,66.29,18.15,83.61,72.67,15.88,Sirmaur,Himachal Pradesh,50.92,57
IR-M-S-156,"T. A. Pai Management Institute, Manipal",60.10,25.90,81.91,70.48,15.51,Manipal,Karnataka,50.78,58
IR-M-U-0555,Graphic Era University,69.16,27.41,59.00,71.68,26.50,Dehradun,Uttarakhand,50.59,59
IR-M-U-0217,Christ University,61.48,22.09,69.90,72.45,42.58,Bengaluru,Karnataka,50.56,60
IR-M-I-1124,"International Management Institute, Bhubaneswar",72.06,16.72,78.94,76.91,2.60,Bhubaneswar,Odisha,50.38,61
IR-M-U-0363,Siksha `O` Anusandhan,70.66,19.77,69.03,75.46,12.04,Bhubaneswar,Odisha,49.69,62
IR-M-C-56616,K J Somaiya Institute of Management Studies and Research,68.84,23.02,72.59,66.72,9.12,Mumbai,Maharashtra,49.66,63
IR-M-S-354,Birla Institute of Management Technology,67.23,18.69,80.54,65.89,9.55,Greater Noida,Uttar Pradesh,49.44,64
IR-M-U-0099,Guru Gobind Singh Indraprastha University,60.92,32.16,73.02,54.04,14.76,New Delhi,Delhi,49.40,65
IR-M-S-331,Loyola Institute of Business Administration,69.63,15.81,72.60,61.76,29.25,Chennai,Tamil Nadu,49.26,66
IR-M-U-0356,Kalinga Institute of Industrial Technology,79.12,22.29,51.75,77.22,7.36,Bhubaneswar,Odisha,49.24,67
IR-M-U-0410,Malaviya National Institute of Technology,48.90,57.63,55.61,57.51,3.10,Jaipur,Rajasthan,49.14,68
IR-M-U-0439,Anna University,53.37,39.59,63.23,45.31,38.52,Chennai,Tamil Nadu,48.92,69
IR-M-U-0496,Aligarh Muslim University,54.24,40.29,68.52,53.44,12.84,Aligarh,Uttar Pradesh,48.68,70
IR-M-U-0213,Alliance University,78.59,9.03,67.19,74.92,11.64,Bengaluru,Karnataka,48.38,71
IR-M-S-419,"Jaipuria Institute of Management, Lucknow",71.51,12.81,72.36,60.82,24.76,Lucknow,Uttar Pradesh,48.32,72
IR-M-U-0749,"Manipal University, Jaipur",66.15,24.92,68.06,69.07,2.60,Jaipur,Rajasthan,48.10,73
IR-M-I-1441,Saveetha Institute of Medical and Technical Sciences,67.57,30.84,51.62,77.73,3.10,Chennai,Tamil Nadu,47.92,74
IR-M-S-309,Jaipuria Institute of Management,71.33,13.88,74.40,56.82,14.38,Jaipur,Rajasthan,47.56,75
IR-M-U-0263,National Institute of Technology Calicut,67.49,24.68,66.03,54.08,12.84,Kozhikode,Kerala,47.55,76
IR-M-U-0223,"Jain University, Bangalore",72.00,11.96,70.81,68.40,12.84,Bengaluru,Karnataka,47.47,77
IR-M-U-0107,Jamia Hamdard,67.80,17.57,70.05,74.13,3.60,New Delhi,Delhi,47.39,78
IR-M-U-0020,Koneru Lakshmaiah Education Foundation University (K L College of Engineering),70.68,26.18,54.41,70.35,3.10,Vaddeswaram,Andhra Pradesh,47.27,79
IR-M-C-37013,PSG College of Technology,60.45,11.27,76.60,57.88,45.02,Coimbatore,Tamil Nadu,47.13,80
IR-M-U-0253,Cochin University of Science and Technology,70.94,19.37,66.27,58.71,8.69,Cochin,Kerala,47.08,81
IR-M-C-36557,Thiagarajar School of Management,66.90,24.31,64.38,47.67,20.06,Madurai,Tamil Nadu,47.02,82
IR-M-U-0735,BML Munjal University,70.47,14.53,66.98,74.64,3.10,Gurgaon,Haryana,46.67,83
IR-M-S-19472,Prin. L.N. Welingkar Institute of Management Development and Research (PGDM),67.48,10.70,81.80,60.71,6.45,Mumbai,Maharashtra,46.53,84
IR-M-U-0267,Atal Bihari Vajpayee Indian Institute of Information Technology and Management,62.24,23.46,71.80,52.78,11.23,Gwalior,Madhya Pradesh,46.47,85
IR-M-U-0498,Babasaheb Bhimrao Ambedkar University,62.44,11.05,78.23,82.67,4.57,Lucknow,Uttar Pradesh,46.42,86
IR-M-S-782,Jagan Institute of Management Studies Technical Campus,66.04,8.36,78.75,70.66,12.44,Delhi,Delhi,46.38,87
IR-M-C-32887,New Delhi Institute of Management,70.21,3.47,79.10,72.49,11.23,Delhi,Delhi,46.29,88
IR-M-U-0147,Pandit Deendayal Energy University,60.14,26.68,75.31,40.80,2.09,Gandhinagar,Gujarat,45.39,89
IR-M-U-0202,Birla Institute of Technology,61.75,23.08,64.18,54.84,12.44,Ranchi,Jharkhand,45.00,90
IR-M-S-14565,National Institute of Bank Management,64.45,8.17,85.01,58.50,2.09,Pune,Maharashtra,44.85,91
IR-M-U-0078,Panjab University,48.21,29.80,69.61,55.78,18.02,Chandigarh,Chandigarh,44.70,92
IR-M-S-164,Rajagiri Business School,65.55,20.92,59.14,56.91,8.69,Cochin,Kerala,44.33,93
IR-M-N-4,Bharathidasan Institute of Management,63.85,0.69,82.36,48.63,34.73,Tiruchirappalli,Tamil Nadu,44.17,94
IR-M-U-0056,Tezpur University,63.73,16.91,68.04,53.22,3.60,Tezpur,Assam,43.48,95
IR-M-S-14553,National Institute of Agricultural Extension Management,69.30,7.76,67.84,60.66,4.09,Hyderabad,Telangana,43.17,96
IR-M-I-1132,Institute of Management Technology,55.45,13.61,75.76,61.83,9.55,Hyderabad,Telangana,43.01,97
IR-M-U-0643,Galgotias University,62.42,14.99,64.51,65.12,2.60,Gautam Budh Nagar,Uttar Pradesh,42.90,98
IR-M-I-1238,Krea University,69.73,2.22,64.61,73.15,9.98,Sri City,Andhra Pradesh,42.82,99
IR-M-U-0025,National Institute of Technology Warangal,63.70,28.57,46.53,46.36,9.98,Warangal,Telangana,42.63,100
