Institute ID,Name,TLR,RPC,GO,OI,Perception,City,State,Score,Rank
IR-R-U-0220,"Indian Institute of Science, Bengaluru",98.56,82.86,73.53,58.36,100.00,Bengaluru,Karnataka,84.98,1
IR-R-U-0456,Indian Institute of Technology Madras,91.96,82.57,77.27,65.56,89.22,Chennai,Tamil Nadu,83.29,2
IR-R-I-1074,Indian Institute of Technology Delhi,85.25,84.78,75.98,66.11,82.56,New Delhi,Delhi,81.08,3
IR-R-U-0306,Indian Institute of Technology Bombay,83.75,78.59,80.10,59.00,71.28,Mumbai,Maharashtra,77.75,4
IR-R-U-0573,Indian Institute of Technology Kharagpur,71.77,78.69,77.43,57.12,63.05,Kharagpur,West Bengal,72.65,5
IR-R-U-0304,Homi Bhabha National Institute,85.81,75.60,68.75,53.67,25.75,Mumbai,Maharashtra,70.11,6
IR-R-I-1075,Indian Institute of Technology Kanpur,76.21,62.81,80.16,60.64,62.54,Kanpur,Uttar Pradesh,70.04,7
IR-R-N-15,All India Institute of Medical Sciences Delhi,81.63,67.68,39.27,71.48,76.43,New Delhi,Delhi,67.43,8
IR-R-U-0560,Indian Institute of Technology Roorkee,72.76,67.91,69.00,62.94,44.85,Roorkee,Uttarakhand,66.78,9
IR-R-U-0053,Indian Institute of Technology Guwahati,74.67,61.56,68.52,61.75,42.03,Guwahati,Assam,64.94,10
IR-R-U-0713,Academy of Scientific and Innovative Research,75.64,69.51,76.78,46.77,6.18,Ghaziabad,Uttar Pradesh,64.20,11
IR-R-U-0330,Tata Institute of Fundamental Research,72.00,56.50,56.29,58.44,48.85,Mumbai,Maharashtra,60.54,12
IR-R-U-0490,Vellore Institute of Technology,54.28,67.42,71.26,61.35,33.87,Vellore,Tamil Nadu,60.28,13
IR-R-U-0120,University of Delhi,57.35,56.25,80.31,67.53,31.75,Delhi,Delhi,60.07,14
IR-R-U-0013,Indian Institute of Technology Hyderabad,67.00,51.39,65.67,59.11,53.99,Hyderabad,Telangana,59.96,15
IR-R-U-0500,Banaras Hindu University,52.58,51.51,85.10,61.67,41.05,Varanasi,Uttar Pradesh,58.52,16
IR-R-U-0439,Anna University,60.10,57.47,58.95,49.03,64.28,Chennai,Tamil Nadu,58.39,17
IR-R-U-0109,Jawaharlal Nehru University,51.90,39.35,88.52,72.12,41.42,New Delhi,Delhi,56.43,18
IR-R-U-0108,Jamia Millia Islamia,55.09,45.13,77.22,83.72,22.38,New Delhi,Delhi,56.12,19
IR-R-I-1441,Saveetha Institute of Medical and Technical Sciences,62.08,57.03,64.04,66.05,7.03,Chennai,Tamil Nadu,55.85,20
IR-R-U-0575,Jadavpur University,55.22,44.66,80.98,49.94,36.87,Kolkata,West Bengal,54.85,21
IR-R-U-0205,Indian Institute of Technology (Indian School of Mines) Dhanbad,59.28,51.38,63.00,58.99,30.81,Dhanbad,Jharkhand,54.77,22
IR-R-U-0234,"Manipal Academy of Higher Education, Manipal",53.84,52.11,66.07,67.35,25.92,Manipal,Karnataka,54.31,23
IR-R-U-0473,S.R.M. Institute of Science and Technology,46.04,55.71,69.13,68.54,21.40,Chennai,Tamil Nadu,53.34,24
IR-R-U-0496,Aligarh Muslim University,47.76,45.36,81.94,61.23,28.35,Aligarh,Uttar Pradesh,53.29,25
IR-R-U-0391,"Birla Institute of Technology and Science, Pilani",53.49,51.63,65.90,58.73,24.65,Pilani,Rajasthan,53.06,26
IR-R-U-0273,Indian Institute of Technology Indore,63.63,46.65,58.04,60.57,19.36,Indore,Madhya Pradesh,52.70,27
IR-R-U-0042,University of Hyderabad,54.39,41.95,73.73,62.31,20.18,Hyderabad,Telangana,51.90,28
IR-R-U-0305,Indian Institute of Science Education and Research Pune,59.08,41.46,54.83,62.09,41.91,Pune,Maharashtra,51.53,29
IR-R-U-0357,National Institute of Technology Rourkela,56.31,45.33,63.27,60.01,20.18,Rourkela,Odisha,51.16,30
IR-R-U-0467,National Institute of Technology Tiruchirappalli,51.85,41.66,57.40,64.72,49.26,Tiruchirappalli,Tamil Nadu,50.94,31
IR-R-U-0139,Indian Institute of Technology Gandhinagar,60.60,36.02,61.13,69.20,26.46,Gandhinagar,Gujarat,50.78,32
IR-R-U-0436,Amrita Vishwa Vidyapeetham,49.42,33.57,68.73,73.70,43.58,Coimbatore,Tamil Nadu,50.38,33
IR-R-U-0224,Jawaharlal Nehru Centre for Advanced Scientific Research,67.83,37.27,46.23,55.91,36.87,Bengaluru,Karnataka,50.06,34
IR-R-U-0078,Panjab University,42.68,45.53,69.70,63.33,30.01,Chandigarh,Chandigarh,49.73,35
IR-R-U-0570,Calcutta University,45.65,34.36,82.15,50.17,31.13,Kolkata,West Bengal,48.57,36
IR-R-U-0101,Indian Agricultural Research Institute,52.56,33.73,63.85,73.91,25.02,New Delhi,Delhi,48.55,37
IR-R-U-0572,Indian Institute of Science Education and Research Kolkata,54.53,36.55,57.48,54.38,30.49,Mohanpur,West Bengal,47.31,38
IR-R-I-1480,Thapar Institute of Engineering and Technology (Deemed-to-be-university),45.77,45.66,60.54,63.85,13.77,Patiala,Punjab,47.30,39
IR-R-U-0308,Institute of Chemical Technology,52.96,38.29,54.33,55.34,30.49,Mumbai,Maharashtra,46.83,40
IR-R-U-0447,Bharathiar University,51.06,35.68,64.19,54.06,25.20,Coimbatore,Tamil Nadu,46.79,41
IR-R-U-0237,"National Institute of Technology Karnataka, Surathkal",49.58,31.04,57.79,62.67,34.02,Surathkal,Karnataka,45.41,42
IR-R-U-0236,"National Institute of Mental Health and Neuro Sciences, Bangalore",62.57,30.70,37.82,64.03,32.37,Bengaluru,Karnataka,45.18,43
IR-R-U-0379,Lovely Professional University,36.53,50.80,54.21,70.22,9.49,Phagwara,Punjab,45.01,44
IR-R-U-0378,Indian Institute of Technology Ropar,53.90,31.67,54.16,65.10,19.77,Rupnagar,Punjab,44.99,45
IR-R-U-0356,Kalinga Institute of Industrial Technology,34.69,35.68,73.05,76.56,12.55,Bhubaneswar,Odisha,44.64,46
IR-R-U-0497,Amity University,39.13,46.82,58.63,65.47,5.01,Gautam Budh Nagar,Uttar Pradesh,44.57,47
IR-R-U-0448,Bharathidasan University,50.14,29.01,69.61,53.32,14.24,Tiruchirappalli,Tamil Nadu,44.41,48
IR-R-U-0377,Indian Institute of Science Education and Research Mohali,47.92,28.15,57.63,65.89,31.44,Mohali,Punjab,44.09,49
IR-R-U-0363,Siksha `O` Anusandhan,38.79,34.00,62.31,72.72,22.96,Bhubaneswar,Odisha,43.87,50
